{
  "evidence_id": "33333333-3333-4333-8333-333333333333",
  "job_id": "11111111-1111-4111-8111-111111111111",
  "connector": "github",
  "resource_uri": "https://github.com/example-org/research-service/blob/0123456789abcdef0123456789abcdef01234567/src/query.py",
  "source_locator": "example-org/research-service@0123456789abcdef0123456789abcdef01234567:src/query.py",
  "title": "Query timeout change",
  "retrieved_at": "2026-10-23T12:20:50Z",
  "content_sha256": "8965de168c6ec4ad5bb3341dafd205bbeeca897a0dc373e0a88b5ef50385dea0",
  "excerpt": "The query timeout was increased from 5 seconds to 30 seconds.",
  "source_span": "src/query.py lines 10-14",
  "classification": "confidential",
  "upstream_tool": "read_github_file"
}
